{
  "schemaVersion": 1,
  "algorithm": "ecdsa-p256-sha256",
  "keyId": "prod-2026-01",
  "payload": "ewogICJwcm9kdWN0VmVyc2lvbiI6ICIxLjAuMCIsCiAgImRldmVsb3BtZW50T25seSI6IGZhbHNlLAogICJhdXRoIjogewogICAgImJhc2VVcmwiOiAiaHR0cHM6Ly9wcmVsYXVuY2gtdW52ZWlsZWQtYWJhY3VzLm5ncm9rLWZyZWUuZGV2LyIKICB9LAogICJqYXZhIjogewogICAgIm1ham9yVmVyc2lvbiI6IDgsCiAgICAicHJvdmlkZXIiOiAiYWRvcHRpdW0iCiAgfSwKICAibWluZWNyYWZ0IjogewogICAgInZlcnNpb24iOiAiMS4xMi4yIiwKICAgICJmb3JnZVZlcnNpb24iOiAiMTQuMjMuNS4yODU5IiwKICAgICJtZW1vcnlNYiI6IDQwOTYKICB9LAogICJzZXJ2ZXIiOiB7CiAgICAiaG9zdCI6ICJ0cmFkZWQtd3JpdGluZ3MudHVuLnBseS5nZyIsCiAgICAicG9ydCI6IDI1NTY1CiAgfSwKICAiZmlsZXMiOiBbCiAgICB7CiAgICAgICJwYXRoIjogIm1vZHMvUkUtdm9sdXRpb24tMS40LjcuamFyIiwKICAgICAgImRvd25sb2FkVXJsIjogImh0dHBzOi8vZ2l0aHViLmNvbS9UaGV5eWsvcmUtdm9sdXRpb24tbW9kL3JlbGVhc2VzL2Rvd25sb2FkL3YxLjQuNy9SRS12b2x1dGlvbi0xLjQuNy5qYXIiLAogICAgICAic2hhMjU2IjogIjJmYzM4ZWFmNjVlNTQ1MmRlZTdjZTMwNGFiMjI2ODlmODUzOTNhMmMyODI5OGM5NjBlOGQzYmRiZGRiODVkYzAiLAogICAgICAic2l6ZSI6IDc2MjE1NiwKICAgICAgInJvbGUiOiAiZ2FtZXBsYXktbW9kIgogICAgfSwKICAgIHsKICAgICAgInBhdGgiOiAibW9kcy9SRS12b2x1dGlvbi1DbGllbnQtTW9kLTEuMC4wLmphciIsCiAgICAgICJkb3dubG9hZFVybCI6ICJodHRwczovL2dpdGh1Yi5jb20vVGhleXlrL3JlLXZvbHV0aW9uLWNsaWVudC9yZWxlYXNlcy9kb3dubG9hZC92MS4wLjAvUkUtdm9sdXRpb24tQ2xpZW50LU1vZC0xLjAuMC5qYXIiLAogICAgICAic2hhMjU2IjogImYxOTU5Y2IzMjUxZmRkZmM4NzdlMWNiN2YwMzc3OGFkYTExOTViMTc4ZjRmNWU5ZDQ5M2ZiMTc5ZjgxNWYwYjUiLAogICAgICAic2l6ZSI6IDU0NjMsCiAgICAgICJyb2xlIjogImNsaWVudC1tb2QiCiAgICB9CiAgXQp9Cg==",
  "signature": "JghRHiQ5D34ViHngJ9zoLlhNLV\u002BpU\u002BvGTEXmwA8INaKrkESFVC9MKGOd9u02qEwxJOsbEMHyiTCrr8zHlg8B3g=="
}
